[
 {
  "slug": "sellaronda",
  "surface": "asphalt",
  "name": "Sellaronda",
  "color": "#8d7bb5",
  "km": 52,
  "elevationGain": 1780,
  "passes": [
   "passo-campolongo",
   "passo-pordoi",
   "passo-sella",
   "passo-gardena"
  ],
  "note": "Autofreier Sellaronda Bike Day im Juni und im September.",
  "season": {
   "closes": 11,
   "opens": 5
  },
  "description": "Dolomiten-Klassikerrunde um den Sella-Stock ab Corvara im Uhrzeigersinn.",
  "type": "loop",
  "waypoints": [
   {
    "lat": 46.549,
    "lon": 11.874
   },
   {
    "lat": 46.519,
    "lon": 11.874
   },
   {
    "lat": 46.497,
    "lon": 11.875
   },
   {
    "lat": 46.488,
    "lon": 11.813
   },
   {
    "lat": 46.496,
    "lon": 11.787
   },
   {
    "lat": 46.509,
    "lon": 11.76
   },
   {
    "lat": 46.548,
    "lon": 11.81
   },
   {
    "lat": 46.549,
    "lon": 11.874
   }
  ]
 },
 {
  "slug": "maratona-dles-dolomites-lang",
  "surface": "asphalt",
  "name": "Maratona dles Dolomites (lang)",
  "color": "#b57a99",
  "km": 138,
  "elevationGain": 4230,
  "passes": [
   "passo-campolongo",
   "passo-pordoi",
   "passo-sella",
   "passo-gardena",
   "passo-giau",
   "passo-falzarego",
   "passo-valparola"
  ],
  "note": "Veranstaltung Anfang Juli, die Pässe sind an dem Tag gesperrt.",
  "season": {
   "closes": 11,
   "opens": 6
  },
  "description": "Sellaronda plus Campolongo (2×), Giau, Falzarego und Valparola ab La Villa.",
  "type": "event",
  "waypoints": [
   {
    "lat": 46.587,
    "lon": 11.905
   },
   {
    "lat": 46.519,
    "lon": 11.874
   },
   {
    "lat": 46.497,
    "lon": 11.875
   },
   {
    "lat": 46.488,
    "lon": 11.813
   },
   {
    "lat": 46.496,
    "lon": 11.787
   },
   {
    "lat": 46.509,
    "lon": 11.76
   },
   {
    "lat": 46.548,
    "lon": 11.81
   },
   {
    "lat": 46.549,
    "lon": 11.874
   },
   {
    "lat": 46.519,
    "lon": 11.874
   },
   {
    "lat": 46.497,
    "lon": 11.875
   },
   {
    "lat": 46.488,
    "lon": 11.99
   },
   {
    "lat": 46.484,
    "lon": 12.055
   },
   {
    "lat": 46.522,
    "lon": 12.11
   },
   {
    "lat": 46.519,
    "lon": 12.008
   },
   {
    "lat": 46.533,
    "lon": 11.985
   },
   {
    "lat": 46.587,
    "lon": 11.905
   }
  ],
  "when": 7
 },
 {
  "slug": "stoneman-dolomiti-road",
  "surface": "asphalt",
  "name": "Stoneman Dolomiti Road",
  "color": "#9a6a5a",
  "km": 193,
  "elevationGain": 4700,
  "passes": [
   "passo-cimabanche",
   "passo-falzarego",
   "passo-giau",
   "passo-tre-croci",
   "tre-cime-di-lavaredo",
   "passo-sant-antonio",
   "passo-monte-croce-comelico"
  ],
  "note": "Beschilderte Dauerstrecke mit Stempelstellen und Startpaket; Gold an einem Tag, Silber in zwei, Bronze in drei. Der Stich zur Auronzohütte ist eine Mautstraße und gibt mit ihrer Saison das Fenster vor.",
  "season": {
   "opens": 6,
   "closes": 10
  },
  "description": "Von Sexten über Toblach und Cimabanche nach Cortina, auf den Falzarego, über Colle Santa Lucia auf den Giau, zurück nach Cortina und über Tre Croci nach Misurina, im Stich hinauf zur Auronzohütte unter den Drei Zinnen, hinab nach Auronzo, über den Passo Sant'Antonio nach Padola und über den Kreuzberg zurück nach Sexten.",
  "type": "permanent",
  "waypoints": [
   {
    "lat": 46.7019,
    "lon": 12.3504
   },
   {
    "lat": 46.733,
    "lon": 12.222
   },
   {
    "lat": 46.6206,
    "lon": 12.184
   },
   {
    "lat": 46.538,
    "lon": 12.136
   },
   {
    "lat": 46.519,
    "lon": 12.008
   },
   {
    "lat": 46.47,
    "lon": 12.0185
   },
   {
    "lat": 46.484,
    "lon": 12.055
   },
   {
    "lat": 46.538,
    "lon": 12.136
   },
   {
    "lat": 46.557,
    "lon": 12.2019
   },
   {
    "lat": 46.583,
    "lon": 12.253
   },
   {
    "lat": 46.612,
    "lon": 12.294
   },
   {
    "lat": 46.583,
    "lon": 12.253
   },
   {
    "lat": 46.5512,
    "lon": 12.443
   },
   {
    "lat": 46.572,
    "lon": 12.4824
   },
   {
    "lat": 46.607,
    "lon": 12.463
   },
   {
    "lat": 46.6559,
    "lon": 12.4201
   },
   {
    "lat": 46.7019,
    "lon": 12.3504
   }
  ]
 },
 {
  "slug": "route-des-grandes-alpes",
  "surface": "asphalt",
  "name": "Route des Grandes Alpes",
  "color": "#c4956a",
  "km": 700,
  "elevationGain": 17000,
  "passes": [
   "col-des-gets",
   "col-de-la-colombiere",
   "col-des-aravis",
   "col-des-saisies",
   "cormet-de-roselend",
   "col-de-l-iseran",
   "col-du-telegraphe",
   "col-du-galibier",
   "col-du-lautaret",
   "col-d-izoard",
   "col-de-vars",
   "col-de-la-cayolle",
   "col-de-valberg",
   "col-de-la-couillole",
   "col-saint-martin",
   "col-de-turini",
   "col-de-castillon"
  ],
  "note": "Der Iseran gibt das Fenster vor; im Oktober nur mit Plan B über den Mont Cenis.",
  "season": {
   "closes": 10,
   "opens": 6.5
  },
  "description": "Thonon-les-Bains – Menton über 17 Pässe, typisch 6–8 Etappen.",
  "type": "stages",
  "waypoints": [
   {
    "lat": 46.371,
    "lon": 6.479
   },
   {
    "lat": 46.061,
    "lon": 6.578
   },
   {
    "lat": 46.019,
    "lon": 6.478
   },
   {
    "lat": 45.941,
    "lon": 6.428
   },
   {
    "lat": 45.87,
    "lon": 6.464
   },
   {
    "lat": 45.818,
    "lon": 6.514
   },
   {
    "lat": 45.76,
    "lon": 6.529
   },
   {
    "lat": 45.719,
    "lon": 6.573
   },
   {
    "lat": 45.674,
    "lon": 6.643
   },
   {
    "lat": 45.618,
    "lon": 6.77
   },
   {
    "lat": 45.449,
    "lon": 6.98
   },
   {
    "lat": 45.417,
    "lon": 7.031
   },
   {
    "lat": 45.372,
    "lon": 7.045
   },
   {
    "lat": 45.286,
    "lon": 6.876
   },
   {
    "lat": 45.2,
    "lon": 6.67
   },
   {
    "lat": 45.218,
    "lon": 6.47
   },
   {
    "lat": 45.199,
    "lon": 6.445
   },
   {
    "lat": 45.165,
    "lon": 6.43
   },
   {
    "lat": 45.064,
    "lon": 6.408
   },
   {
    "lat": 45.034,
    "lon": 6.405
   },
   {
    "lat": 44.897,
    "lon": 6.636
   },
   {
    "lat": 44.82,
    "lon": 6.735
   },
   {
    "lat": 44.66,
    "lon": 6.65
   },
   {
    "lat": 44.538,
    "lon": 6.702
   },
   {
    "lat": 44.417,
    "lon": 6.732
   },
   {
    "lat": 44.387,
    "lon": 6.652
   },
   {
    "lat": 44.259,
    "lon": 6.744
   },
   {
    "lat": 44.09,
    "lon": 6.854
   },
   {
    "lat": 44.095,
    "lon": 6.931
   },
   {
    "lat": 44.098,
    "lon": 6.988
   },
   {
    "lat": 44.134,
    "lon": 7.048
   },
   {
    "lat": 44.083,
    "lon": 7.107
   },
   {
    "lat": 44.066,
    "lon": 7.256
   },
   {
    "lat": 43.979,
    "lon": 7.391
   },
   {
    "lat": 43.878,
    "lon": 7.448
   },
   {
    "lat": 43.827,
    "lon": 7.488
   },
   {
    "lat": 43.775,
    "lon": 7.497
   }
  ]
 },
 {
  "slug": "oetztaler-radmarathon",
  "surface": "asphalt",
  "name": "Ötztaler Radmarathon",
  "color": "#6f9fb0",
  "km": 227,
  "elevationGain": 5500,
  "passes": [
   "kuehtai",
   "brennerpass",
   "jaufenpass",
   "timmelsjoch"
  ],
  "note": "Veranstaltung Ende August; die Timmelsjoch-Maut ist für Räder frei.",
  "season": {
   "closes": 10,
   "opens": 6
  },
  "description": "Sölden – Kühtai – Innsbruck – Brenner – Jaufenpass – Timmelsjoch – Sölden.",
  "type": "event",
  "waypoints": [
   {
    "lat": 46.968,
    "lon": 11.007
   },
   {
    "lat": 47.204,
    "lon": 10.895
   },
   {
    "lat": 47.213,
    "lon": 11.021
   },
   {
    "lat": 47.256,
    "lon": 11.272
   },
   {
    "lat": 47.262,
    "lon": 11.394
   },
   {
    "lat": 47.005,
    "lon": 11.505
   },
   {
    "lat": 46.897,
    "lon": 11.431
   },
   {
    "lat": 46.836,
    "lon": 11.312
   },
   {
    "lat": 46.812,
    "lon": 11.247
   },
   {
    "lat": 46.906,
    "lon": 11.093
   },
   {
    "lat": 46.968,
    "lon": 11.007
   }
  ],
  "when": 8.5
 },
 {
  "slug": "la-marmotte",
  "surface": "asphalt",
  "name": "La Marmotte",
  "color": "#7f86b8",
  "km": 174,
  "elevationGain": 5000,
  "passes": [
   "col-du-glandon",
   "col-du-telegraphe",
   "col-du-galibier",
   "col-du-lautaret",
   "alpe-d-huez"
  ],
  "note": "Der Galibier gibt das Fenster vor; Veranstaltung Anfang Juli.",
  "season": {
   "closes": 10.5,
   "opens": 6
  },
  "description": "Bourg d'Oisans – Glandon – Télégraphe – Galibier – Lautaret – Alpe d'Huez.",
  "type": "event",
  "waypoints": [
   {
    "lat": 45.055,
    "lon": 6.03
   },
   {
    "lat": 45.104,
    "lon": 5.994
   },
   {
    "lat": 45.24,
    "lon": 6.176
   },
   {
    "lat": 45.358,
    "lon": 6.303
   },
   {
    "lat": 45.276,
    "lon": 6.347
   },
   {
    "lat": 45.218,
    "lon": 6.47
   },
   {
    "lat": 45.199,
    "lon": 6.445
   },
   {
    "lat": 45.165,
    "lon": 6.43
   },
   {
    "lat": 45.064,
    "lon": 6.408
   },
   {
    "lat": 45.034,
    "lon": 6.405
   },
   {
    "lat": 45.055,
    "lon": 6.03
   },
   {
    "lat": 45.092,
    "lon": 6.07
   }
  ],
  "when": 7
 },
 {
  "slug": "andermatt-drei-paesse-runde",
  "surface": "asphalt",
  "name": "Andermatt Drei-Pässe-Runde",
  "color": "#6fa89f",
  "km": 120,
  "elevationGain": 3500,
  "passes": [
   "furkapass",
   "grimselpass",
   "sustenpass"
  ],
  "note": "Alpenbrevet Anfang September.",
  "season": {
   "closes": 10.5,
   "opens": 6.5
  },
  "description": "Furka – Grimsel – Susten, zurück durch die Schöllenenschlucht.",
  "type": "loop",
  "waypoints": [
   {
    "lat": 46.635,
    "lon": 8.594
   },
   {
    "lat": 46.598,
    "lon": 8.503
   },
   {
    "lat": 46.572,
    "lon": 8.415
   },
   {
    "lat": 46.562,
    "lon": 8.36
   },
   {
    "lat": 46.562,
    "lon": 8.337
   },
   {
    "lat": 46.706,
    "lon": 8.226
   },
   {
    "lat": 46.729,
    "lon": 8.446
   },
   {
    "lat": 46.706,
    "lon": 8.599
   },
   {
    "lat": 46.667,
    "lon": 8.589
   },
   {
    "lat": 46.635,
    "lon": 8.594
   }
  ]
 },
 {
  "slug": "stilfserjoch-umbrail-runde",
  "surface": "asphalt",
  "name": "Stilfserjoch–Umbrail-Runde",
  "color": "#b09068",
  "km": 70,
  "elevationGain": 2000,
  "passes": [
   "passo-dello-stelvio",
   "umbrailpass"
  ],